,date,num_friends,num_photos,num_reviews,review_id,review_text,username
237,7/9/2014,2,0,1,aM8PAO6ocnaRFqnxfyKKCw,Great food and great environment! The prices are good and there is a variety of Chinese cuisine!,Patrick C.
238,7/6/2014,239,7,23,ULpmRYhhAcww4cTmsZZDVQ,"My girlfriend and I found this spot on Yelp, yesterday evening, so we decided to pick some up to go. ",Austin C.
239,7/6/2014,65,24,218,sNl7ZqjaUmLt5vm0HZ15-Q,"Very nice place. Probably worthy of five stars - just give me some time! This is another one of those places that I drive by regularly that I would have never gone to had it not been for Yelp. Thanks, Yelp!",Vlad W.
240,6/30/2014,0,0,30,71WtWq1IRVq7to6a30ml4A,"So surprised at how high quality the ingredients and cooking are!  Everything about the food screams quality! Super fresh fruits, delicious non greasy meats. Yeah, the meat is very soft. My friend and I love this place",Randy M.
241,6/29/2014,0,4,42,CBjR3qzJ2Lxm803o7vWlvw,What? No! This place gets way to many stars. It's gross! The environment is bleak and the food is too. The only reason I give it two stars is because the employees were nice and attentive.,J C.
242,6/10/2014,76,2,287,eIEZ1KQB-drC5Fvoz7QdIA,Who would have thought to have such a nice little gem tucked away in such a sleepy town as Eagle Rock.,Calvin F.
243,6/5/2014,1,0,6,MtWAwoeC-9XRfxbalQgefA,"Dine In, Delivery, Take-Out. This place has got it goin on! House Fried Rice is the best fried rice I've ever had (and I'm not a huge fan of fried rice). It includes shrimp, chicken, and pork (OMG the PORK! is soooo good) No matter what you decide to order, do yourself a favor and order this fried rice as a side dish or even a main dish. You will thank me later. The Crispy Orange Chicken is a specialty and now I totally get why. It's perfectly crisp and tender at the same time. How do they do it? The Beef Chow Fun with Black Bean Sauce is very tasty and the meat is tender and cooked to perfection. Kung Pao Chicken is not too spicy but still delicious and the peanuts add a perfect crunch. They don't overload with sauce on any dishes and none of the food is greasy its just perfection! Even their white rice is amazing. ",Catherine J.
244,6/4/2014,4,0,48,cFiTjijyO8L5K0fSCoLEEg,"I like. My Chinese wife likes. Food quality, pricing, service is great. This restaurant does a great service providing hot Chinese cooking for all of the pretentious ambiguously gendered skinny jean- Iphone users of Eagle Rock. Thank you, and please keep the immigrant dream alive through good cooking and capitalism.",Karl H.
245,5/25/2014,8,1,18,oq_oS-uWxypLZw-9TWGHig,Food tastes great and they give you a lot. Doesn't make you feel all f'ed up after eating it like lower quality Chinese food. Definitely get the food to go...interior isn't that great to eat in. White rice is a dollar extra...which is kinda ridic,Phillip C.
246,5/10/2014,1,1,16,UTF_HufHkT9VNgWld8CkBA,Great customer service -- everyone is extremely nice.,C F.
247,5/4/2014,1,9,16,EgMF2xl0isTiy9vuCqQb2A,"We decided to check this place out because of some of the reviews on here. Boy was it worth it. The pork dumplings and beef with rice noodle were delicious to start off with, but the stir fried fish and kung pao chicken were terrific! 5 stars",JD W.
248,5/4/2014,0,0,1,87ZUWT5h1WgMARcGCipq6g,"It is not the traditional greasy salty Chinese food loaded with MSG. It is a much improved, much healthier version of authentic Chinese food that is tasty in a gentle and delicate way. In addition, the place is clean and the service is awesome!!",Joe B.
249,5/2/2014,21,4,14,vBKStLU1--s0k0sQznvQSg,"Great Chinese food close by, again! Food is awesome, it's not too salty or greasy like most Chinese food tends to be. It's a family owned business, it's nice to see that instead of cheap food chains everywhere.",Milly A.
250,4/28/2014,3,0,15,P0G1xFuhGzkKMe4uamv4yQ,"Finally, we found a Chinese restaurant that we could recommend! Our niece ordered the food and all of them were delicious. The fish fillet was crispy, the honey walnut shrimp heavenly, the bed of white noodles crunchy. My husband loved the Pan Fried Noodles.  They even gave us a nicely arranged dessert plate of cut fresh oranges, almond cookies and fortune cookies. The place was neat, the tablecloth fresh and clean. The owners were very friendly and attentive. We will go back to this place definitely. The place is in a kind of mall with many parking spaces. It is nice to find a gem in our neighborhood.",Donna F.
251,4/1/2014,6,0,23,NI-YWPzB9ybz-lOoTOykuw,"It's your local Chinese joint. The family that runs it are so sweet. The food is generously portioned and tasty. We often do take out, but dine in sometimes too. The healthy options are definitely less greasy than some other dishes. The dinner option adds some appetizers, soup, and rice to your entree. It's a good value. They are very accommodating to families with young children. We like them!",J M.
252,3/31/2014,0,0,7,MimVkzANp93vzMAn9YCDzQ,Fried Wonton is our favorite Appetizer here. You should have this and it will really keep your appetite! The service is fast and the staff are very nice.,Mj M.
253,3/23/2014,72,17,153,fUDZCqAw3nzqqDondxMvlQ,"I'm not sure what the haters who have reviewed this place are used to eating (Panda Express?), but I'm Cantonese and this is the kind of food I grew up with.",Michelle C.
254,3/18/2014,0,0,8,PO-qREvHyusReGtoxkUU0A,"WTF? Your restaurant is the only one I ever been to that consider. . . rice, a very small amount of it... as side order! That is not the way my generations and generations of the FAR EAST do business!",Michelle L.
255,3/9/2014,9,51,78,ZiFyk42fnqnmPnWUGhwOyg,"Good food. We ordered the Kung Pao Chicken and the Beef Lo Mein and one order of egg rolls. All of the food was decent (I don't eat beef so I'm not sure about that one) but it didn't have any pizazz. It was just good. It wasn't great, I wasn't wowed. If my husband wanted to go back, I would but I wouldn't recommend it myself. I should probably also say that my husband is from Miami and eats a lot of Chinese food when he is there. I usually eat Thai. In any case. You should try them out. You may Love it.",Shareon S.
256,3/4/2014,6,0,22,5nzAsVFnOIIVgSEtbA9UqQ,"Convenient location with plenty of parking. Pleasant servers, but unfortunately the food was mediocre at best. I ordered the Kung Pao Chicken which is usually hot and spicy, but it had very little red peppers and was too mild for Kung Pao. I can't believe Yelp reviews gave this a high score, oh well, back to the hunt for good Chinese. This place doesn't make the grade.",Linda S.
257,3/3/2014,24,9,34,RnkjcbZCfWsvHtbgHEzk7g,"Absolutely amazed! This restaurant is what gives Eagle Rock such a vibrant and dynamic environment with so many cultures and culinary places to visit, Green Dragon is a must try! ",Ryan J.
258,2/27/2014,7,10,66,GtkcPj9IPNo8rSIiSOP3PA,"I've been here about 6 times and I think the food is very good and plentiful. The prices are reasonable and the service is fine when there aren't too many people. The owners are friendly and always courteous. I recommend the egg foo young with chicken, pork or shrimp. I like the fact that they give you 3 little desserts, a fortune cookie, an almond cookie & a fancy cut half an orange! This food may be Americanized but it's good enough for me. I don't need to go to San Gabriel or even Chinatown.",Ruben I. N.
259,2/26/2014,70,1,11,S0RNZ_5v_6ucSfbVfPieDA,Such a great place for Chinese food. Went there tonight with my family and it was great! Ordered the beef broccoli and Shrimp Lo Mien so good!! And another great thing was the service everyone is so nice and attentive. I would definitely suggest to other friends.,Jessica N.
260,1/31/2014,770,597,811,pZPsqzj9-6codAfib42mAQ,Green Dragon is our go to local Chinese restaurant whenever we're too lazy to drive out to the SGV. I can't say it's the BEST Chinese food I've had... but everything has been pretty good and they're very friendly and welcoming.,Clara K.
261,1/27/2014,12,0,2,u4Ju7JNH9QJsqgqJ0qDVvw,"Randomly picked this place for lunch today without knowing anything about it. Really wasn't expecting too much considering it was in a strip mall that seems to have a new business every week.  I am so glad that we picked it though. Enough good things have been said about this place so there isn't much to add.  I would give this place 4 stars if located anywhere else.  The fact that it's in Eagle Rock and they deliver puts it over the top for me.  I will definitely be ordering from them soon. Finally, decent Chinese takeout in Eagle Rock!",Kenneth J.
262,1/26/2014,120,1091,974,tAifVqbP3TYnXT8RmL9CEA,"This is a very good place. Owners are great hosts. Food is delicious and plenty. Had Beef with Green Beans, Orange Beef, Pork Fried Rice and Chicken Pan Fried Noodles. Loved them all.  ",Denny B.
263,1/25/2014,6,3,40,1vVxbM_aP3IOCcHn6-Ijgg,"This is the great old-fashioned Americanized Chinese food I've been looking for in Los Angeles. Don't get me wrong, I love the traditional Chinese Chinese food that one finds in Alhambra an San Gabriel, and make the 20-30 min drive that way usually once a week for dumplings. But on a night where you want the Chinese food that is found in the rest of America, the kind with the predictable menu with nothing you haven't heard of, Green Dragon is the place. It's not too greasy, it's not too expensive, it's just good ol' ""Chinese Food.""",Aaron S.
264,1/22/2014,3,11,26,5PidGUVR8ojOMyYxQYvwbw,Been 10 months since my first review here...they now have music and less noise in the kitchen!! And they are soooo friendly!!!! Food is super fresh and we never leave disappointed or hungry!!!!,Michelle A.
265,1/18/2014,36,0,3,_4vl3jD6iDjG8zMNAtzJRA,"Can't always get downtown when I want authentic Chinese. So we've been looking for a solid neighborhood spot in Eagle Rock. Found it! For what it is, food is tasty. Owners are very pleasant & family-friendly. Service was excellent -- a lot of hustle (but not chaotic). This was only my first visit -- of everything we ordered, I recommend the *Singapore* noodles. Don't let your eyes get the better of you though, portions are generous.",La Mont T.
266,1/14/2014,116,1550,268,BE--5SgH1K-Qeb2nOLVnGg,"This place is an average okay. I ordered beef with orange peel sauce, hot and sour soup, minced chicken lettuce cups and chicken pan fried noodles. Out of all the dishes we ordered I enjoyed the hot and sour soup the most. The beef with orange sauce was way to sweet, and you really couldn't taste the beef. The lettuce were okay and good serving. The pan fried noodles were a big salty. If you are craving Chinese food- schezuan style and don't feel like driving to Chinatown, this place is okay. Authentic enough and good to fill your tummy.",Rhonald N.
267,1/9/2014,92,10,45,i37Ydh9HA6BP9HiZOkfnBg,"Ordered out for some sweet & sour chicken (pretty yum!), pan fried pork dumplings (the best I've had in awhile! Two thumbs up!), and some very satisfying wor wonton soup! ",Sofie R.
268,1/6/2014,1,2,15,STGoFQWyvZoEoQmUz42ohw,"Great, flavorful food! Dumplings are a must. The delivery person was fast and very nice. We usually take out, so I can't speak for the dinning in experience.",Rachel G.
269,1/4/2014,131,0,10,BqGF1FazKxlj7BU4Z3fXbA,One of my favorite places in town. They're hot and sour soup and fried rice is one of our favorites. We usually order take out an average of once a month. Definitely check this place out.,Kim E.
270,12/27/2013,0,0,24,FHryMfEftyd1EMGWGwuoeg,Clearly the folks who give this place high marks have never ventured 7 miles south to Chinatown and/or have no idea what quality Chinese food is supposed to taste like. ,Markus H.
271,12/26/2013,66,3,3,7JeqAaaD41OOWgbs0FeDoA,"Hands down, the best Chinese food I've ever had. We eat here at least three times a month and have never been disappointed. The service is always outstanding, and they'll deliver if you live close by.",Jen P.
272,12/22/2013,77,98,283,E1br-P8EQtoN_xAWZLD_cA,"Open on Sunday, yes!",Carlos F.
273,12/13/2013,0,28,9,-jK9TmCd7myVY9SLwkUHrw,"Good food at reasonable price. Love their lunch special & wonton soup. Unlike other Chinese restaurants, this place is very clean.",Thomas C.
274,11/21/2013,133,0,7,vXFgZAcZQpRbBcGu2DxKUg,"Fresh, fast and very delicious. We got hooked the first time we ordered take out. They really are thoughtful with everything from food preparation, packaging food for freshness and we like the way they package condiments, fortune cookies and almond cookies in one plastic bag... its the little things! We really like the dumplings are a must every time we order. ",Mat H.
275,11/18/2013,0,5,21,pEw2_VZrKdZKyeFgEJ7xBQ,"I have lived in Pasadena for 12 years, and I have always wondered why there isn't any good Chinese food restaurants in a community of so many Chinese folks!!! Yes, we can drive down to Monterey Park or San Gabriel... but I have longed for a local restaurant with the same quality food. I am so happy I found Green Dragon!!! The dishes are very standard ""American Chinese""... But done very well, I think. But I'm an American Born Chinese person, haha, so it suits me just fine!",Madeline Y.
276,11/14/2013,21,1,33,OmRaIfPbCfHWkKbU4vUNqA,Its hard to change your 2000 year old dishes to suite American tastes.,Esteban A.
277,11/3/2013,58,43,10,ohhkVpMyx8RsBFJGEFFnOQ,Waited for 55mins on our food to go! Instead of apologizing the Waitress/manager told us to call in our order instead. I'd rather go to china town or monterey park for some real chinese food. Too pricey for some mediocre chinese food.,Hazel C.
278,10/31/2013,16,0,17,Iu4hZ1PSxWjEFHgrIwnAWw,I love asian food in the San Gabriel Valley. I hate driving there. Green Dragon keeps me local with quality Chinese food. Service is sufficient. Dumplings are great. The home delivery was sufficient. I will continue eating here!,Robert S.
279,10/30/2013,0,0,21,GdhQCuAu2m0tAJxk5QALSA,We were so excited to find a Chinese restaurant close to home and this one has not disappointed. We've tried a good portion of the menu (since we come often) and have many favorites. These are just a few:,Patricia T.
280,10/25/2013,56,7,31,WhreGhvhoRXEdqYUOkYoXQ,"This review is on a delivery order from today. My girlfriend and I ordered the wor won ton soup which seemed to have good reviews according to Yelp, this certainly wasn't the case this time. The won tons were mushy and the broth seemed to lack flavor, however, was extremely hot upon arrival. We also ordered the honey sesame shrimp which were crispy and flavorful! In addition, we ordered the house special lo mein which not only was lacking flavor, but the shrimp inside were extremely fishy and dirty tasting, the pork (if it was even pork) had a weird distinctive flavor. Chinese food is my absolute favorite and I don't get to indulge too often because my girlfriend isn't as big of a fan as myself, I'm just so disappointed in the quality of the food and the inconsistency with the reviews. This is the first and last time I eat here.",Jessica F.
281,10/20/2013,233,20,18,_IJwc2RCXX-UpKAuyvC8og,It's all about the Wor Wonton soup here and the steame pork dumplings. If it isn't my favorite Pho 87 ill be driving here for the wonton. Great service and prices with quality dishes perfectly prepared will make sure you leave this place happy.,Warren L.
282,10/19/2013,24,22,15,G6VQi-mgGTUd-lUd-jP_gA,"I ordered the tasty shrimp because frankly, the picture on yelp looked amazing. Guess what... It was! I ordered some chopped green onion just to sprinkle on top and then once I added a heavy dose of white pepper to the dish, magic! My mouth opened and started to flow brine like a suicidal oyster ready to be shucked. ",Jamie W.
283,10/13/2013,0,0,14,pek632ILaaViRflV3qa58w,"everything fresh fresh fresh.  if you order a vegetable dish, they ask - vegetarian or vegan? (different saucing, seasoning) . first time went with friends. 4 days later ordered delivery. 6 days after that ordered delivery again. tomorrow going with 7 people.  ",Judy S.
284,9/29/2013,3,4,23,D45a4bNYtyCspv-Ixb0O0g,"Wow! I am so happy to find the Green Dragon so close to home. Our dinner was cooked perfectly. Crispy lemon chicken, with the sauce served on the side allows you to add just the right amount of sweet tartness without overwhelming the dish. Plump potstickers with a chewy texture-- delicious. And the green beans were crisp, flavorful and fresh! Complimentary Hot tea served in a pot, juicy orange segments, almond cookie and the mandatory fortune cookie finished the meal perfectly. I only wish I had known they don't have their beer/wine license yet. ",BA T.
285,9/28/2013,0,0,1,bGSxXpowjqxTbfrUxmmS_g,Very good food.,J.G. G.
286,9/17/2013,54,3,29,OpnkL2Y3HMn6r_NpRdNaLw,We order from Green Dragon about twice a month. I'm not typically one for Chinese food but I definitely don't mind this place. The guy that usually delivers to us is super friendly and our dinner is always hot when it gets here! Win!,Danielle C.
287,9/16/2013,4,26,29,YpMCz0VZfy4Q52QeQ09a-A,Yum! I'm giving this 4 stars for being really good local fast Chinese food with delivery!,A K.
288,9/11/2013,543,42,47,JtcGHJV1JirWELFavilNWg,"We've ordered Green Dragon delivered twice now and it's REALLY good! This is western Chinese food, the kind us white folk grew up on. If you know what I'm talking about then you will know it is hard to find good western Chinese these days.",Winter M.
289,9/9/2013,74,0,5,i7i8rD8eU_xlA8-nEnMZTg,"I agree this is the best Chinese joint on the NE side of LA. Large fresh tasting portions, great service, and very clean. Check it out",Samuel L.
290,9/4/2013,5,1,25,kvA7XGnsi1cj_I90-P16-A,"I absolutely love this place! The Szechuan eggplant is the best thing ever (get it with pork). The orange peel beef is really good as is the cashew chicken. The only thing I didn't love were the pan fried noodles. No ""wow"" there, just bland. But I will keep going back for the eggplant alone.",Kristina J.
291,9/4/2013,28,36,30,1lBb0vEudyFr2Vy3sBplsw,Love the rice here. I love the service also. My parents showed me this place because my aunt showed them this place because my cousin showed it to my aunt. Now we always come here,Karina Sanchez S.
292,9/3/2013,23,8,17,5Ykl8aGDhIyGNhl19RUJyA,"YAY! We really needed a fantastic Chinese restaurant on the East side. Thank you Green Dragon! My favorites so far: Szechuan String beans. I don't know how string beans can be this good. Trust me, they are insane.  Some other faves are the Mandarin Filet Mignon, Cashew Chicken, and Sizzling rice soup but I'm excited to try the rest! Great service & friendly staff to boot.",Sara L.
293,8/27/2013,66,29,314,U7OrUlA2WhpaLWZon8UBxQ,Restaurant: Not too big. Cozy. Very clean!,Elizabeth K.
294,8/25/2013,0,0,6,9Oofq3T-N476m60b94c8Qw,"The food here is so yummy! Everything tasted light and ""clean"" - not heavy. The hot things were served very hot and service was cheerful and attentive. My parents love the food here so much that they drive in from Arcadia a few times a month to enjoy the wonderful flavors!",S B.
295,8/21/2013,49,2,15,HFuwkHegy3_cPgerV4_Vyg,"I LOVE this place. The sizzling rice soup is my fave to order when I feel a little under the weather, or it's too hot to eat... Or I don't feel like cooking. :) The dumplings are a fave as well. In fact, everything we have ordered has been delicious. ",Sarah B.
296,8/20/2013,3,4,12,Qd9qtPOm5O2vNymu7ObEvQ,"I have been to this restaurant three times now for lunch with co-workers. Like other reviewers, the taste is bland and it seems you are having the same dish no matter which one you choose. The portions seem larger then normal for lunch specials. They are over feeling for sure. We will try out others in the area but will keep this one in mind if we are near by.",Pat K.
297,7/25/2013,25,0,23,OT1rgIGBbCrv1iN-s0Gksw,4 stars is a bit high. Had the Fun noodles - bland. Soup was good not great. Special shrimp with avocado was interesting and tasty. The place is clean.,Dan F.
298,7/15/2013,13,0,6,finBfSTYcDdjuXjQUOXEIw,"We traveled to Eagle Rock from the Westside because we had heard our beloved waiter/waitress from our favorite Chinese restaurant (Chang's in Brentwood) had opened up their own restaurant. Now, we have a NEW favorite restaurant. The food was just as delicious if not more so than Chang's. Turns out Green Dragon's chef defected from Chang's, too, so no surprise that the food was absolutely superb: very fresh and flavorful in abundant portions. Our three young sons are particularly critical of Chinese dishes, and are always comparing wherever we go to Chang's. However, from their first bites of Green Dragon's pork steamed dumplings to their last bites of sesame shrimp and all the chicken moo shoo and beef lo mein in between, they were begging to make coming to Eagle Rock for Green Dragon a new family tradition.",Lilli L.
299,7/14/2013,40,31,115,L54zORm3LbNfG9bTeM9n1A,"Finally, a solid Chinese food spot in Eagle Rock. Beyond the shadow of a doubt, Green Dragon is the best Chinese food you find in Northeast LA outside of Chinatown. I've dined there at least ten times now since their opening, and have always been satisfied with the resulting meal. Very consistent.",Phillip J.
